<?xml version="1.0" encoding="UTF-8"?>
<!--Sample XML file generated by XMLSpy v2014 sp1 (x64) (http://www.altova.com)-->
<cers:RegulatorFacilityQuery xmlns:xsi="http://www.w3.org/2001/XMLSchema-instance" xmlns:cers="http://cersservices.calepa.ca.gov/Schemas/RegulatorFacilityQuery/1/05/" timeStamp="2001-12-17T09:30:47Z" returnedResultCount="0" totalQueryResultCount="0" transactionKey="00000000-0000-0000-0000-000000000000" xsi:schemaLocation="http://cersservices.calepa.ca.gov/Schemas/RegulatorFacilityQuery/1/05/ RegulatorFacilityQuery.xsd">
	<Facility>
		<CERSID>10000001</CERSID>
		<FacilityID>String</FacilityID>
		<FacilityRegulatorKey>String</FacilityRegulatorKey>
		<RegulatorCode>0</RegulatorCode>
		<Name>String</Name>
		<LastSubmittalOn>1985-01-01</LastSubmittalOn>
		<EstablishedOn>1985-01-01</EstablishedOn>
		<Organization>
			<Code>10000001</Code>
			<Name>String</Name>
			<Headquarters>String</Headquarters>
			<FacilityCount>0</FacilityCount>
			<UserCount>0</UserCount>
			<LeadRegulatorCode>0</LeadRegulatorCode>
			<LastSubmittalOn>1985-01-01</LastSubmittalOn>
			<Origin>1</Origin>
		</Organization>
		<SubmittalElements>
			<FacilityInformation regulatorCode="1" reportingRequirement="3" nextDueDate="1985-01-01"/>
			<HazardousMaterialsInventory regulatorCode="1" reportingRequirement="2" nextDueDate="1985-01-01"/>
			<EmergencyResponseTrainingPlans regulatorCode="1" reportingRequirement="2" nextDueDate="1985-01-01"/>
			<UndergroundStorageTanks regulatorCode="1" reportingRequirement="3" nextDueDate="1985-01-01"/>
			<OnsiteHazardousWasteTreatmentNotification regulatorCode="1" reportingRequirement="1" nextDueDate="1985-01-01"/>
			<RecyclableMaterialsReport regulatorCode="1" reportingRequirement="3" nextDueDate="1985-01-01"/>
			<RemoteWasteConsolidationsAnnualNotification regulatorCode="1" reportingRequirement="3" nextDueDate="1985-01-01"/>
			<HWTankClosureCertification regulatorCode="1" reportingRequirement="2" nextDueDate="1985-01-01"/>
			<AbovegroundPetroleumStorageTanks regulatorCode="1" reportingRequirement="3" nextDueDate="1985-01-01"/>
			<CaliforniaAccidentalReleasePrevention regulatorCode="1" reportingRequirement="1" nextDueDate="1985-01-01"/>
		</SubmittalElements>
		<FacilityAddress>
			<SiteAddress>String</SiteAddress>
			<SupplementalAddress>String</SupplementalAddress>
			<City>String</City>
			<ZipCode>String</ZipCode>
		</FacilityAddress>
		<StandardizedAddress>
			<SiteAddress></SiteAddress>
			<City></City>
			<ZipCode></ZipCode>
		</StandardizedAddress>
		<GeographicInformation>
			<CERSPoint>
				<LatitudeMeasure>aaaa</LatitudeMeasure>
				<LongitudeMeasure>aaaa</LongitudeMeasure>
				<HorizontalAccuracyMeasure>0</HorizontalAccuracyMeasure>
				<HorizontalCollectionMethod>104</HorizontalCollectionMethod>
				<GeographicReferencePoint>101</GeographicReferencePoint>
				<HorizontalReferenceDatum>NAD83</HorizontalReferenceDatum>
				<DataCollectionDate>1957-08-13</DataCollectionDate>
			</CERSPoint>
		</GeographicInformation>
	</Facility>
	<Facility>
		<CERSID>10000001</CERSID>
		<FacilityID>String</FacilityID>
		<FacilityRegulatorKey>String</FacilityRegulatorKey>
		<RegulatorCode>0</RegulatorCode>
		<Name>String</Name>
		<LastSubmittalOn>1985-01-01</LastSubmittalOn>
		<EstablishedOn>1985-01-01</EstablishedOn>
		<Organization>
			<Code>10000001</Code>
			<Name>String</Name>
			<Headquarters>String</Headquarters>
			<FacilityCount>0</FacilityCount>
			<UserCount>0</UserCount>
			<LeadRegulatorCode>0</LeadRegulatorCode>
			<LastSubmittalOn>1985-01-01</LastSubmittalOn>
			<Origin>2</Origin>
		</Organization>
		<SubmittalElements>
			<FacilityInformation regulatorCode="1" reportingRequirement="2" nextDueDate="1985-01-01"/>
			<HazardousMaterialsInventory regulatorCode="1" reportingRequirement="3" nextDueDate="1985-01-01"/>
			<EmergencyResponseTrainingPlans regulatorCode="1" reportingRequirement="2" nextDueDate="1985-01-01"/>
			<UndergroundStorageTanks regulatorCode="1" reportingRequirement="3" nextDueDate="1985-01-01"/>
			<OnsiteHazardousWasteTreatmentNotification regulatorCode="1" reportingRequirement="2" nextDueDate="1985-01-01"/>
			<RecyclableMaterialsReport regulatorCode="1" reportingRequirement="3" nextDueDate="1985-01-01"/>
			<RemoteWasteConsolidationsAnnualNotification regulatorCode="1" reportingRequirement="2" nextDueDate="1985-01-01"/>
			<HWTankClosureCertification regulatorCode="1" reportingRequirement="2" nextDueDate="1985-01-01"/>
			<AbovegroundPetroleumStorageTanks regulatorCode="1" reportingRequirement="3" nextDueDate="1985-01-01"/>
			<CaliforniaAccidentalReleasePrevention regulatorCode="1" reportingRequirement="1" nextDueDate="1985-01-01"/>
		</SubmittalElements>
		<FacilityAddress>
			<SiteAddress>String</SiteAddress>
			<SupplementalAddress>String</SupplementalAddress>
			<City>String</City>
			<ZipCode>String</ZipCode>
		</FacilityAddress>
		<StandardizedAddress>
			<SiteAddress>String</SiteAddress>
			<City>String</City>
			<ZipCode>String</ZipCode>
			<StreetRange>String</StreetRange>
			<StreetPreDirection>String</StreetPreDirection>
			<StreetName>String</StreetName>
			<StreetPostDirection>String</StreetPostDirection>
			<StreetSuffix>String</StreetSuffix>
			<Suite>String</Suite>
		</StandardizedAddress>
		<GeographicInformation>
			<CERSPoint>
				<LatitudeMeasure>aaaa</LatitudeMeasure>
				<LongitudeMeasure>aaaa</LongitudeMeasure>
				<HorizontalAccuracyMeasure>0</HorizontalAccuracyMeasure>
				<HorizontalCollectionMethod>103</HorizontalCollectionMethod>
				<GeographicReferencePoint>102</GeographicReferencePoint>
				<HorizontalReferenceDatum>WGS84</HorizontalReferenceDatum>
				<DataCollectionDate>1957-08-13</DataCollectionDate>
			</CERSPoint>
		</GeographicInformation>
	</Facility>
</cers:RegulatorFacilityQuery>
